{
  "schema_version": "3.0.0",
  "fixture_id": "current-signal665-futures-r1",
  "description": "Current Signal 665 added-clause futures exact boundary fixture.",
  "fixture_kind": "x7-branch-probe",
  "evidence_status": "captured",
  "created_at": "2026-08-23T01:41:17.247045Z",
  "freqtrade": {
    "version": "2026.5.1",
    "image": "freqtradeorg/freqtrade",
    "image_index_digest": "sha256:d47d7053dc07eca2ace20385575143090ba88621007e5e8b76052dca6038799a",
    "image_platform_digest": "sha256:bc5b7276118a8539d09ea797cb32c198d029a805815a29c6d27d5f610a3e0b6b",
    "platform": "linux/amd64",
    "tracer_version": "1.1.0",
    "exchange": "binance",
    "strategy": "CurrentSignal665ContractFutures",
    "timerange": "20220401-20220402",
    "timeframe": "5m",
    "timeframe_detail": null,
    "trading_mode": "futures",
    "margin_mode": "isolated",
    "command": [
      "freqtrade",
      "backtesting",
      "--strategy",
      "CurrentSignal665ContractFutures",
      "--timerange",
      "20220401-20220402",
      "--cache",
      "none",
      "--export",
      "trades"
    ]
  },
  "inputs": [
    {
      "role": "strategy",
      "path": "inputs/strategy.py",
      "sha256": "76fccc908a30aae42d3a4373c52941981b23fdd124ab509ed5f4e186a5995494",
      "bytes": 83947
    },
    {
      "role": "config",
      "path": "inputs/config.json",
      "sha256": "a2acfde38334170fd899f2db93a92dc37d978eb77c7747cba8aaa1733f656f75",
      "bytes": 814
    },
    {
      "role": "candles",
      "path": "inputs/data/futures/BTC_USDT_USDT-15m-futures.feather",
      "sha256": "57b9d74c54cb4532db4e6284e370786937ef81de5cc7bea2f62f9b9468c5c6db",
      "bytes": 127535
    },
    {
      "role": "candles",
      "path": "inputs/data/futures/BTC_USDT_USDT-1d-futures.feather",
      "sha256": "4a2476c20aee865f266877524370bfac15f051736f59a62be8d83555be6dd716",
      "bytes": 40751
    },
    {
      "role": "funding_candles",
      "path": "inputs/data/futures/BTC_USDT_USDT-1h-funding_rate.feather",
      "sha256": "05743e03a0c6a27c4982f6ced69ab7ca53480fc63798c83a362e076d6bcd2759",
      "bytes": 119471
    },
    {
      "role": "candles",
      "path": "inputs/data/futures/BTC_USDT_USDT-1h-futures.feather",
      "sha256": "694043d9f9cbff2a2b6e76ae9aab82bb44224bf6a1fdb331429c4cdcab79db3d",
      "bytes": 61871
    },
    {
      "role": "mark_candles",
      "path": "inputs/data/futures/BTC_USDT_USDT-1h-mark.feather",
      "sha256": "f396311879cdbe430db65cd19d2cdc1f8dd0a481012fdb72462496b7a69307b3",
      "bytes": 945071
    },
    {
      "role": "candles",
      "path": "inputs/data/futures/BTC_USDT_USDT-4h-futures.feather",
      "sha256": "a94f8a932fc53ec6d08febe4da1a1f1d57680c602166b32430c989a3ba3bf647",
      "bytes": 45359
    },
    {
      "role": "candles",
      "path": "inputs/data/futures/BTC_USDT_USDT-5m-futures.feather",
      "sha256": "4faa67166ecb375cb9283f5a3495cc1e2ea5658640afcffc3a4d6e1460b6c5ae",
      "bytes": 302639
    },
    {
      "role": "market_metadata",
      "path": "inputs/market_metadata/full-x7-futures-20210101-markets.json",
      "sha256": "7ec68fd38560fd0da589e2572fd2135c542b64d4c62056ecc919095180b31b86",
      "bytes": 171531
    },
    {
      "role": "reference_market_metadata",
      "path": "inputs/reference_market_metadata/reference-markets.json",
      "sha256": "b959dfd2fd3776718b5eadad6254ca238e65374560020f606db9b8af6cb485c6",
      "bytes": 9239
    }
  ],
  "artifacts": {
    "freqtrade_result": {
      "path": "artifacts/freqtrade-result.zip",
      "sha256": "b2a2a8421347c82904d5322d09352028b673022d0031106939e7b4efcd95203e",
      "bytes": 13936
    },
    "trade_surface": {
      "path": "artifacts/trade-surface.json",
      "sha256": "8d98f9898b95c27048a41cc3286a9a69d99bac921fd046e0fd488bfcf24cc420",
      "bytes": 2329
    },
    "state_trace": {
      "path": "artifacts/state-trace.nfitrace",
      "sha256": "363719c6bbf0e06e3fd28b4ac4d874f7a441283111d5c0e482a5cfdc0aac1470",
      "bytes": 527517
    },
    "coverage_report": {
      "path": "artifacts/coverage-report.json",
      "sha256": "77ebe82b38857c2644b6d604f9d718b3a8e15b0b3f74bbbd520fa1b7bcb5496b",
      "bytes": 651
    },
    "state_projection": {
      "path": "artifacts/state-projection.nfitrace",
      "sha256": "71560ad61628b0e3040ef6259c9c33f38b25915740528a3ffd0e9524352be213",
      "bytes": 138395
    }
  },
  "measurement": {
    "warmup_runs": 1,
    "measured_runs": 3,
    "poll_interval_ms": 100,
    "required_profile_phases": [
      "indicators",
      "callbacks",
      "trade_scans",
      "event_simulation"
    ]
  },
  "probe_kind": "callback-route",
  "strategy_provenance": {
    "upstream_repository": "https://github.com/iterativv/NostalgiaForInfinity.git",
    "upstream_commit": "649890f727fce8067a66f7556431b7ce0ee64416",
    "base_source_sha256": "145142b0eeeb7e86908116556743b67336fa144d50517e4974b41c5500bb577a",
    "effective_source_sha256": "76fccc908a30aae42d3a4373c52941981b23fdd124ab509ed5f4e186a5995494",
    "transformations": [
      {
        "kind": "config-override",
        "description": "41 added Signal 665 protection clauses extracted in source order"
      }
    ]
  },
  "required_coverage": {
    "callbacks": [],
    "entry_tags": [
      "665"
    ],
    "compound_tags": [],
    "protection_methods": [],
    "exit_reasons": [],
    "sides": [
      "short"
    ],
    "minimum_lock_count": 0,
    "minimum_distinct_leverages": 1,
    "minimum_funded_trades": 0,
    "require_rejected_locked_entry": false
  }
}
